{
  "cbsdId": "sas1/cbsd1",
  "grantId": "sas1/grant1",
  "grantRenew": true,
  "operationState": "Transmission",
  "operationParam": {
     "palCredential": [ "license" ],
     "peakPower": 30,
     "operationFrequencyRange": { "lowFrequency": 3600000000, "highFrequency": 3610000000 }
  },
  "measReport": {
  }
}
